sentiment,text
pos,"a sensitive , cultivated treatment of greene's work as well as a remarkably faithful one ."
pos,"well-acted , well-directed and , for all its moodiness , not too pretentious ."
neg,gaping plot holes sink this 'sub'-standard thriller and drag audience enthusiasm to crush depth .
pos,"mr . deeds is , as comedy goes , very silly -- and in the best way ."
neg,"humorless , self-conscious art drivel , made without a glimmer of intelligence or invention ."
pos,"often gruelling and heartbreaking to witness , but seldahl and wollter's sterling performances raise this far above the level of the usual maudlin disease movie ."
pos,the animated sequences are well done and perfectly constructed to convey a sense of childhood imagination and creating adventure out of angst .
neg,"reeboir varies between a sweet smile and an angry bark , while said attempts to wear down possible pupils through repetition . it has no affect on the kurds , but it wore me down ."
pos,"tully is in many ways the perfect festival film : a calm , self-assured portrait of small town regret , love , duty and friendship that appeals to the storytelling instincts of a slightly more literate filmgoing audience ."
neg,"[it's] a prison soccer movie starring charismatic tough guy vinnie jones , but it had too much spitting for me to enjoy ."
neg,"bisset delivers a game performance , but she is unable to save the movie ."
pos,australian actor/director john polson and award-winning english cinematographer giles nuttgens make a terrific effort at disguising the obvious with energy and innovation .
pos,so unique and stubborn and charismatic that you want it to be better and more successful than it is .
pos,a fairly enjoyable mixture of longest yard . . . and the 1999 guy ritchie caper lock stock and two smoking barrels .
neg,completely creatively stillborn and executed in a manner that i'm not sure could be a single iota worse . . . a soulless hunk of exploitative garbage .
pos,"the genius of the work speaks volumes , offering up a hallucinatory dreamscape that frustrates and captivates ."
pos,"though nijinsky's words grow increasingly disturbed , the film maintains a beguiling serenity and poise that make it accessible for a non-narrative feature ."
neg,another useless recycling of a brutal mid-'70s american sports movie .
pos,"a film of epic scale with an intimate feeling , a saga of the ups and downs of friendships ."
neg,"if this dud had been made in the '70s , it would have been called the hills have antlers and played for about three weeks in drive-ins ."
neg,"i believe silberling had the best intentions here , but he just doesn't have the restraint to fully realize them ."
neg,"the sight of the name bruce willis brings to mind images of a violent battlefield action picture , but the film has a lot more on its mind--maybe too much ."
neg,the one not-so-small problem with expecting is that the entire exercise has no real point .
pos,"flavorful and romantic , you could call this how martha got her groove back -- assuming , that is , she ever had one to begin with ."
neg,there's no getting around the fact that this is revenge of the nerds revisited -- again .
neg,"the problem is that for the most part , the film is deadly dull ."
neg,"like an afterschool special with costumes by gianni versace , mad love looks better than it feels ."
pos,"a gripping movie , played with performances that are all understated and touching ."
pos, . . . a guiltless film for nice evening out .
neg,the movie's biggest shocks come from seeing former nymphette juliette lewis playing a salt-of-the-earth mommy named minnie and watching slim travel incognito in a ridiculous wig no respectable halloween costume shop would ever try to sell .
pos,bogdanovich tantalizes by offering a peep show into the lives of the era's creme de la celluloid .
pos,vereté has a whip-smart sense of narrative bluffs .
neg,"it's hard to imagine any recent film , independent or otherwise , that makes as much of a mess as this one ."
neg,i've heard that the fans of the first men in black have come away hating the second one . i wonder why . they felt like the same movie to me .
pos,"this english-language version . . . does full honor to miyazaki's teeming and often unsettling landscape , and to the conflicted complexity of his characters ."
neg,"i don't mind having my heartstrings pulled , but don't treat me like a fool ."
pos,"the cast . . . keeps this pretty watchable , and casting mick jagger as director of the escort service was inspired ."
pos,"a breathtaking adventure for all ages , spirit tells its poignant and uplifting story in a stunning fusion of music and images ."
neg,"i didn't find much fascination in the swinging . what they're doing is a matter of plumbing arrangements and mind games , of no erotic or sensuous charge . but that they are doing it is thought-provoking ."
pos,"a witty , whimsical feature debut ."
neg,"we never truly come to care about the main characters and whether or not they'll wind up together , and michele's spiritual quest is neither amusing nor dramatic enough to sustain interest ."
neg,the film is undone by anachronistic quick edits and occasional jarring glimpses of a modern theater audience watching the events unfold .
neg,"it smacks of purely commercial motivation , with no great love for the original ."
neg,"though it pretends to expose the life of male hustlers , it's exploitive without being insightful ."
pos,"this warm and gentle romantic comedy has enough interesting characters to fill several movies , and its ample charms should win over the most hard-hearted cynics ."
pos,"you just know something terrible is going to happen . but when it does , you're entirely unprepared ."
pos,polished korean political-action film is just as good -- and bad -- as hollywood action epics . is this progress ?
neg,"a graceless , witless attempt at mating some like it hot with the wwii espionage thriller ."
neg,not just unlikable . disturbing . disgusting . without any redeeming value whatsoever .
neg,"another big , dumb action movie in the vein of xxx , the transporter is riddled with plot holes big enough for its titular hero to drive his sleek black bmw through ."
neg,"considering the harsh locations and demanding stunts , this must have been a difficult shoot , but the movie proves rough going for the audience as well ."
neg,"if damon and affleck attempt another project greenlight , next time out they might try paying less attention to the miniseries and more attention to the film it is about ."
pos,it's a fairy tale that comes from a renowned indian film culture that allows americans to finally revel in its splendor .
pos,here's yet another cool crime movie that actually manages to bring something new into the mix .
neg,"it can't decide if it wants to be a mystery/thriller , a romance or a comedy ."
neg,"schnieder bounces around with limp wrists , wearing tight tummy tops and hip huggers , twirling his hair on his finger and assuming that's enough to sustain laughs . . ."
pos,"broomfield reminds us that beneath the hype , the celebrity , the high life , the conspiracies and the mystery there were once a couple of bright young men -- promising , talented , charismatic and tragically doomed ."
neg,"the château would have been benefited from a sharper , cleaner script before it went in front of the camera . not to mention a sharper , cleaner camera lens ."
pos,"so fiendishly cunning that even the most jaded cinema audiences will leave the auditorium feeling dizzy , confused , and totally disorientated . not to mention absolutely refreshed ."
pos,"a poignant and compelling story about relationships , food of love takes us on a bumpy but satisfying journey of the heart ."
neg,a dreary indulgence .
neg,the story and characters are nowhere near gripping enough .
neg,sandra bullock's best dramatic performance to date ( is ) almost enough to lift ( this ) thrill-kill cat-and-mouser . . . above its paint-by-numbers plot .
pos,a solidly entertaining little film .
neg,"blessed with a searing lead performance by ryan gosling ( murder by numbers ) , the movie is powerful and provocative . it's also built on a faulty premise , one it follows into melodrama and silliness ."
neg,"i liked the movie , but i know i would have liked it more if it had just gone that one step further . i'm left slightly disappointed that it didn't ."
pos, . . . spellbinding fun and deliciously exploitative .
neg,"the cinematic equivalent of patronizing a bar favored by pretentious , untalented artistes who enjoy moaning about their cruel fate ."
pos,"unfolds in a low-key , organic way that encourages you to accept it as life and go with its flow ."
pos,"it's enough to watch huppert scheming , with her small , intelligent eyes as steady as any noir villain , and to enjoy the perfectly pitched web of tension that chabrol spins ."
neg,the director's twitchy sketchbook style and adroit perspective shifts grow wearisome amid leaden pacing and indifferent craftsmanship ( most notably wretched sound design ) .
neg,it drowns in sap .
neg,abysmally patheti
pos,"at once emotional and richly analytical , the cosby-seinfeld encounter alone confirms the serious weight behind this superficially loose , larky documentary ."
neg,doesn't amount to much of anything .
pos,"it's a film that's destined to win a wide summer audience through word-of-mouth reviews and , not far down the line , to find a place among the studio's animated classics ."
pos,what distinguishes time of favor from countless other thrillers is its underlying concern with the consequences of words and with the complicated emotions fueling terrorist acts .
neg,"as dumb and cheesy as they may be , the cartoons look almost shakespearean -- both in depth and breadth -- after watching this digital-effects-heavy , supposed family-friendly comedy ."
neg,one thing is for sure : this movie does not tell you a whole lot about lily chou-chou .
neg,so unremittingly awful that labeling it a dog probably constitutes cruelty to canines .
neg,done in mostly by a weak script that can't support the epic treatment .
neg,"a broad , melodramatic estrogen opera that's pretty toxic in its own right ."
pos,"a minor work yet there's no denying the potency of miller's strange , fleeting brew of hopeful perseverance and hopeless closure ."
pos,"terrific as nadia , a russian mail-order bride who comes to america speaking not a word of english , it's kidman who holds the film together with a supremely kittenish performance that gradually accumulates more layers ."
neg,the fetid underbelly of fame has never looked uglier .
pos,"third time's the charm . . . yeah , baby !"
pos,"an absorbing , slice-of-depression life that touches nerves and rings true ."
neg,"i can't remember the last time i saw an audience laugh so much during a movie , but there's only one problem it's supposed to be a drama ."
neg,"too intensely focused on the travails of being hal hartley to function as pastiche , no such thing is hartley's least accessible screed yet ."
neg,"trivial where it should be profound , and hyper-cliched where it should be sincere ."
pos,"[ "" safe conduct "" ] is a long movie at 163 minutes but it fills the time with drama , romance , tragedy , bravery , political intrigue , partisans and sabotage . viva le resistance !"
pos,deserves a place of honor next to nanook as a landmark in film history .
pos,"it might be tempting to regard mr . andrew and his collaborators as oddballs , but mr . earnhart's quizzical , charming movie allows us to see them , finally , as artists ."
neg,a sub-formulaic slap in the face to seasonal cheer .
pos,its sheer dynamism is infectious .
pos,"with spy kids 2 : the island of lost dreams , however , robert rodriguez adorns his family-film plot with an elegance and maturity that even most contemporary adult movies are lacking ."
pos,"even if you can't pronounce "" gyro "" correctly , you'll appreciate much of vardalos' humor , which transcends ethnic boundaries ."
neg,pretentious editing ruins a potentially terrific flick .
pos,"nicolas philibert observes life inside a one-room schoolhouse in northern france in his documentary to be and to have , easily one of the best films of the year ."
pos,adam sandler ! in an art film !
pos,moonlight mile doesn't quite go the distance but the cast is impressive and they all give life to these broken characters who are trying to make their way through this tragedy .
neg,it's so badly made on every level that i'm actually having a hard time believing people were paid to make it .
neg,"ah , the travails of metropolitan life ! alas , another breathless movie about same !"
pos,nice piece of work .
pos,digital-video documentary about stand-up comedians is a great glimpse into a very different world .
pos,best enjoyed as a work of fiction inspired by real-life events . those seeking a definitive account of eisenstein's life would do better elsewhere .
pos,a return to pure disney magic and is enjoyable family fare .
pos,what a great way to spend 4 units of your day .
pos,the movie should be credited with remembering his victims .
pos,"it arrives with an impeccable pedigree , mongrel pep , and almost indecipherable plot complications ."
neg,"passion , lip-synching , tragedy , and lots of really really high notes . for me , this opera isn't a favorite , so it's a long time before the fat lady sings ."
pos,[woo's] most resonant film since the killer .
neg,the film didn't convince me that calvin jr . 's barbershop represents some sort of beacon of hope in the middle of chicago's south side .
neg,"like a documentary version of fight club , shorn of social insight , intellectual pretension and cinematic interest ."
neg,"unfortunately , kapur modernizes a . e . w . mason's story to suit the sensibilities of a young american , a decision that plucks "" the four feathers "" bare ."
pos,a small movie with a big heart .
pos,"a typically observant , carefully nuanced and intimate french coming-of-age film that is an encouraging debut feature but has a needlessly downbeat ending that is too heavy for all that has preceded it ."
pos,"a slick , engrossing melodrama ."
neg,it's hard to imagine that even very small children will be impressed by this tired retread .
neg,fairly successful at faking some pretty cool stunts but a complete failure at trying to create some pretty cool characters . and forget about any attempt at a plot !
neg,apparently reassembled from the cutting-room floor of any given daytime soap .
neg,the satire is just too easy to be genuinely satisfying .
neg,"if this movie belonged to a sorority , it would be called beta alpha delta ."
neg,"by the end of it all i sort of loved the people onscreen , even though i could not stand them . perhaps the film should be seen as a conversation starter . it's not an easy one to review ."
pos,a charming yet poignant tale of the irrevocable ties that bind .
neg,the entire movie is filled with deja vu moments .
neg,the thought of watching this film with an audience full of teenagers fixating on its body humour and reinforcement of stereotypes ( of which they'll get plenty ) fills me with revulsion .
neg,it may play well as a double feature with mainstream foreign mush like my big fat greek weddin
pos,"many went to see the attraction for the sole reason that it was hot outside and there was air conditioning inside , and i don't think that a . c . will help this movie one bit ."
neg,feels less like a change in [herzog's] personal policy than a half-hearted fluke .
pos,"the most wondrous love story in years , it is a great film ."
neg,"nicks refuses to let slackers be seen as just another teen movie , which means he can be forgiven for frequently pandering to fans of the gross-out comedy ."
pos,"as an entertainment , the movie keeps you diverted and best of all , it lightens your wallet without leaving a sting ."
pos,is it a total success ? no . is it something any true film addict will want to check out ? you bet .
pos,disney has always been hit-or-miss when bringing beloved kids' books to the screen . . . tuck everlasting is a little of both .
pos,"not as good as the full monty , but a really strong second effort ."
neg,"a few hours after you've seen it , you forget you've been to the movies ."
neg,"the characters are interesting and the relationship between yosuke and saeko is worth watching as it develops , but there's not enough to the story to fill two hours ."
neg,"'the war of the roses , ' trailer-trash style . entertaining but like shooting fish in a barrel ."
neg," "" feardotcom "" has the makings of an interesting meditation on the ethereal nature of the internet and the otherworldly energies it could channel , but it simply becomes a routine shocker ."
pos,"chilling , well-acted , and finely directed : david jacobson's dahmer ."
pos,"rife with the rueful , wry humor springing out of yiddish culture and language ."
pos,"it's too harsh to work as a piece of storytelling , but as an intellectual exercise -- an unpleasant debate that's been given the drive of a narrative and that's been acted out -- the believer is nothing less than a provocative piece of work ."
neg,"tartakovsky's team has some freakish powers of visual charm , but the five writers slip into the modern rut of narrative banality ."
pos, . . . a rich and intelligent film that uses its pulpy core conceit to probe questions of attraction and interdependence and how the heart accomodates practical needs . it is an unstinting look at a collaboration between damaged people that may or may not qua
neg,"while glover , the irrepressible eccentric of river's edge , dead man and back to the future , is perfect casting for the role , he represents bartleby's main overall flaw ."
pos,a gentle and engrossing character study .
neg,"it's the kind of movie that ends up festooning u . s . art house screens for no reason other than the fact that it's in french ( well , mostly ) with english subtitles and is magically 'significant' because of that ."
neg,"although huppert's intensity and focus has a raw exhilaration about it , the piano teacher is anything but fun ."
pos,the writing is clever and the cast is appealing .
pos,"until it goes off the rails in its final 10 or 15 minutes , wendigo , larry fessenden's spooky new thriller , is a refreshingly smart and newfangled variation on several themes derived from far less sophisticated and knowing horror films ."
pos,"too much of storytelling moves away from solondz's social critique , casting its audience as that of intellectual lector in contemplation of the auteur's professional injuries ."
pos,"does what a fine documentary does best : it extends a warm invitation into an unfamiliar world , then illuminates it fully and allows the larger implications of the journey to sink in unobtrusively ."
pos,"every once in a while , a movie will come along that turns me into that annoying specimen of humanity that i usually dread encountering the most - the fanbo"
neg,it won't be long before you'll spy i spy at a video store near you .
neg,unfortunately the story and the actors are served with a hack script .
pos,"passionate , irrational , long-suffering but cruel as a tarantula , helga figures prominently in this movie , and helps keep the proceedings as funny for grown-ups as for rugrats ."
pos,"pratfalls aside , barbershop gets its greatest play from the timeless spectacle of people really talking to each other ."
pos,"the story , like life , refuses to be simple , and the result is a compelling slice of awkward emotions ."
pos,"foster nails the role , giving a tight , focused performance illuminated by shards of feeling ."
neg,"when 'science fiction' takes advantage of the fact that its intended audience hasn't yet had much science , it does a disservice to the audience and to the genre ."
pos,"with a cast that includes some of the top actors working in independent film , lovely & amazing involves us because it is so incisive , so bleakly amusing about how we go about our lives ."
neg,"so routine , familiar and predictable , it raises the possibility that it wrote itself as a newly automated final draft computer program ."
neg,"here , common sense flies out the window , along with the hail of bullets , none of which ever seem to hit sascha ."
pos,"deflated ending aside , there's much to recommend the film ."
neg,"stars matthew perry and elizabeth hurley illicit more than a chuckle , and more jokes land than crash , but ultimately serving sara doesn't distinguish itself from the herd ."
pos,"efteriades gives the neighborhood -- scenery , vibe and all -- the cinematic equivalent of a big , tender hug ."
neg,"it's coherent , well shot , and tartly acted , but it wears you down like a dinner guest showing off his doctorate ."
pos,"sound the trumpets : for the first time since desperately seeking susan , madonna doesn't suck as an actress ."
neg,simplistic fluff-ball of whimsy .
pos,the grey zone gives voice to a story that needs to be heard in the sea of holocaust movies . . . but the film suffers from its own difficulties .
neg,the rules of attraction gets us too drunk on the party favors to sober us up with the transparent attempts at moralizing .
neg,"an unremittingly ugly movie to look at , listen to , and think about , it is quite possibly the sturdiest example yet of why the dv revolution has cheapened the artistry of making a film ."
pos,a charming romantic comedy that is by far the lightest dogme film and among the most enjoyable .
pos,"often hilarious , well-shot and , importantly , entertaining , hell house is a fascinating document of an event that has to be seen to be believed ."
neg,there's not a comedic moment in this romantic comedy .
neg,a fake street drama that keeps telling you things instead of showing them .
pos,michael gerbosi's script is economically packed with telling scenes .
pos,"the performers are so spot on , it is hard to conceive anyone else in their roles ."
neg,"the histrionic muse still eludes madonna and , playing a charmless witch , she is merely a charmless witch ."
pos,"is red dragon worthy of a place alongside the other hannibal movies ? as hannibal would say , yes , 'it's like having an old friend for dinner' ."
neg,"in spite of featuring a script credited to no fewer than five writers , apparently nobody here bothered to check it twice ."
neg,"behind the glitz , hollywood is sordid and disgusting . quelle surprise !"
pos,"the ensemble cast turns in a collectively stellar performance , and the writing is tight and truthful , full of funny situations and honest observations ."
neg,obstacles are too easily overcome and there isn't much in the way of character development in the script .
pos,veterans of the dating wars will smirk uneasily at the film's nightmare versions of everyday sex-in-the-city misadventures .
neg,blue crush is so prolonged and boring it isn't even close to being the barn-burningly bad movie it promised it would be .
neg,"drumline is -- the mere suggestion , albeit a visually compelling one , of a fully realized story ."
neg,"philip k . dick must be turning in his grave , along with my stomach ."
neg,the advantage of a postapocalyptic setting is that it can be made on the cheap . any rock pile will do for a set . reign of fire has the disadvantage of also looking cheap .
pos,"the film's almost unbearable portrait of sadness and grief transcends its specific story to speak to the ways in which need , history and presumption tangle , and sometimes destroy , blood ties ."
neg,full of the kind of obnoxious chitchat that only self-aware neurotics engage in .
neg,the film's few ideas are stretched to the point of evaporation ; the whole central section is one big chase that seems to have no goal and no urgency . it's just filler .
pos,at 78 minutes it just zings along with vibrance and warmth .
pos,"birthday girl is an amusing joy ride , with some surprisingly violent moments ."
pos, . . . a good film that must have baffled the folks in the marketing department .
pos,an interesting look behind the scenes of chicago-based rock group wilco . . .
neg,"returning aggressively to his formula of dimwitted comedy and even dimmer characters , sandler , who also executive produces , has made a film that makes previous vehicles look smart and sassy ."
pos,the obnoxious title character provides the drama that gives added clout to this doc .
pos,a well paced and satisfying little drama that deserved better than a direct-to-video' release .
neg,"though it draws several decent laughs , it's low-cal woody at best ."
neg,"resident evil is what comes from taking john carpenter's ghosts of mars and eliminating the beheadings . in other words , about as bad a film you're likely to see all year ."
pos,"enjoyably fast-moving , hard-hitting documentary ."
neg,"the most horrific movie experience i've had since "" can't stop the music . "" it may as well be called "" jar-jar binks : the movie . "" it's that painful ."
neg,"a tired , unimaginative and derivative variation of that already-shallow genre ."
neg,"it all unfolds predictably , and the adventures that happen along the way seem repetitive and designed to fill time , providing no real sense of suspense ."
neg,earnest but heavy-handed .
neg,the subject of swinging still seems ripe for a documentary -- just not this one .
pos,"thanks to haynes' absolute control of the film's mood , and buoyed by three terrific performances , far from heaven actually pulls off this stylistic juggling act ."
pos,"it makes compelling , provocative and prescient viewing ."
neg,"`martin lawrence live' is so self-pitying , i almost expected there to be a collection taken for the comedian at the end of the show ."
