sentiment,text
pos,the script by david koepp is perfectly serviceable and because he gives the story some soul . . . he elevates the experience to a more mythic level .
pos,"while the ideas about techno-saturation are far from novel , they're presented with a wry dark humor ."
neg,"solondz may be convinced that he has something significant to say , but he isn't talking a talk that appeals to me ."
pos,"the vivid lead performances sustain interest and empathy , but the journey is far more interesting than the final destination ."
neg,"shouldn't have been allowed to use the word "" new "" in its title , because there's not an original character , siuation or joke in the entire movie ."
neg,"swinging , the film makes it seem , is not a hobby that attracts the young and fit . or intelligent ."
neg,ear-splitting exercise in formula crash-and-bash action .
neg,"just like hearst's enormous yacht , it's slow and unwieldy and takes a long time to reach its destination ."
pos,"beating the austin powers films at their own game , this blaxploitation spoof downplays the raunch in favor of gags that rely on the strength of their own cleverness as opposed to the extent of their outrageousness ."
neg,it appears to have been modeled on the worst revenge-of-the-nerds clichés the filmmakers could dredge up .
neg,a ragbag of cliches .
neg,"credit must be given to harland williams , michael rosenbaum and barry watson , who inject far more good-natured spirit and talent into this project than it deserve"
neg,i suspect that there are more interesting ways of dealing with the subject .
pos,captivates and shows how a skillful filmmaker can impart a message without bludgeoning the audience over the head .
pos,this is an undeniably intriguing film from an adventurous young talent who finds his inspiration on the fringes of the american underground .
pos,"the film is small in scope , yet perfectly formed ."
pos,likely to expertly drum up repressed teenage memories in any viewer .
pos,if your taste runs to 'difficult' films you absolutely can't miss it .
neg,there is so much plodding sensitivity .
pos,miyazaki is one of world cinema's most wondrously gifted artists and storytellers .
neg,a rote exercise in both animation and storytelling .
neg,the pace of the film is very slow ( for obvious reasons ) and that too becomes off-putting .
pos,"the year 2002 has conjured up more coming-of-age stories than seem possible , but take care of my cat emerges as the very best of them ."
neg,"this is a picture that maik , the firebrand turned savvy ad man , would be envious of : it hijacks the heat of revolution and turns it into a sales tool ."
neg,"despite engaging offbeat touches , knockaround guys rarely seems interested in kicking around a raison d'etre that's as fresh-faced as its young-guns cast ."
pos,"though overall an overwhelmingly positive portrayal , the film doesn't ignore the more problematic aspects of brown's life ."
pos,"as relationships shift , director robert j . siegel allows the characters to inhabit their world without cleaving to a narrative arc ."
pos,"sandra nettelbeck beautifully orchestrates the transformation of the chilly , neurotic , and self-absorbed martha as her heart begins to open ."
pos,the tug of war that ensues is as much a snapshot of modern china in microcosm as it is a crash course in movie mythology .
pos,"filled with honest performances and exceptional detail , baran is a gentle film with dramatic punch , a haunting ode to humanity ."
neg,"i've had more interesting -- and , dare i say , thematically complex -- bowel movements than this long-on-the-shelf , point-and-shoot exercise in gimmicky crime drama ."
neg,these two are generating about as much chemistry as an iraqi factory poised to receive a un inspector .
neg,"it's just weirdness for the sake of weirdness , and where human nature should be ingratiating , it's just grating ."
pos,"what's so fun about this silly , outrageous , ingenious thriller is the director's talent . watching a brian depalma movie is like watching an alfred hitchcock movie after drinking twelve beers ."
neg,"a film that presents an interesting , even sexy premise then ruins itself with too many contrivances and goofy situations ."
pos,a remarkable 179-minute meditation on the nature of revolution .
pos,"it might be 'easier' to watch on video at home , but that shouldn't stop die-hard french film connoisseurs from going out and enjoying the big-screen experience ."
neg,"presents nothing special and , until the final act , nothing overtly disagreeable ."
neg,the darker elements of misogyny and unprovoked violence suffocate the illumination created by the two daughters and the sparse instances of humor meant to shine through the gloomy film noir veil .
neg,less a study in madness or love than a study in schoolgirl obsession .
pos,"anyone who welcomes a dash of the avant-garde fused with their humor should take pleasure in this crazed , joyous romp of a film ."
pos,this is such a dazzlingly self-assured directorial debut that it's hard to know what to praise first .
neg,"a boring , pretentious muddle that uses a sensational , real-life 19th-century crime as a metaphor for -- well , i'm not exactly sure what -- and has all the dramatic weight of a raindrop ."
neg,it's frustrating to see these guys -- who are obviously pretty clever -- waste their talent on parodies of things they probably thought were funniest when they were high .
pos,"the quiet american isn't a bad film , it's just one that could easily wait for your pay per view dollar ."
neg,"only a few minutes elapse before the daddy of all slashers arrives , still with the boiler suit and white mask , which look remarkably clean for a guy who has been mass-murdering since 1978 but has never been seen doing laundry ."
neg,"it is parochial , accessible to a chosen few , standoffish to everyone else , and smugly suggests a superior moral tone is more important than filmmaking skil"
neg,a great idea becomes a not-great movie .
neg,"[green is] the comedy equivalent of saddam hussein , and i'm just about ready to go to the u . n . and ask permission for a preemptive strike ."
neg,what you expect is just what you get . . . assuming the bar of expectations hasn't been raised above sixth-grade height .
neg,"the movie's major and most devastating flaw is its reliance on formula , though , and it's quite enough to lessen the overall impact the movie could have had ."
pos,"cantet perfectly captures the hotel lobbies , two-lane highways , and roadside cafes that permeate vincent's day"
pos,more sophisticated and literate than such pictures usually are . . . an amusing little catch .
neg,"it's as if a bored cage spent the duration of the film's shooting schedule waiting to scream : "" got aids yet ? """
neg,one of the worst movies of the year . . . . watching it was painful .
neg,"bray is completely at sea ; with nothing but a savage garden music video on his resume , he has no clue about making a movie ."
neg,"'yes , that's right : it's forrest gump , angel of death . "
neg, . . . nothing scary here except for some awful acting and lame special effects .
pos,the best film of the year 2002 .
pos,"despite its floating narrative , this is a remarkably accessible and haunting film ."
pos,a surprisingly 'solid' achievement by director malcolm d . lee and writer john ridley .
neg,"a pale xerox of other , better crime movies ."
pos,"shainberg weaves a carefully balanced scenario that is controlled by neither character , is weirdly sympathetic to both and manages to be tender and darkly comic ."
neg,"broder's screenplay is shallow , offensive and redundant , with pitifully few real laughs ."
pos,"on the surface , it's a lovers-on-the-run crime flick , but it has a lot in common with piesiewicz's and kieslowski's earlier work , films like the double life of veronique ."
neg,is it a comedy ? a drama ? a romance ? a cartoon ?
pos,"a gently funny , sweetly adventurous film that makes you feel genuinely good , that is to say , entirely unconned by false sentiment or sharp , overmanipulative hollywood practices ."
neg,viewers of barney's crushingly self-indulgent spectacle will see nothing in it to match the ordeal of sitting through it .
pos,"while insomnia is in many ways a conventional , even predictable remake , nolan's penetrating undercurrent of cerebral and cinemantic flair lends ( it ) stimulating depth ."
neg,"mark wahlberg . . . may look classy in a '60s-homage pokepie hat , but as a character he's dry , dry , dry ."
pos,"a solidly constructed , entertaining thriller that stops short of true inspiration ."
neg,"all's well that ends well , and rest assured , the consciousness-raising lessons are cloaked in gross-out gags ."
pos,"for a movie audience , the hours doesn't connect in a neat way , but introduces characters who illuminate mysteries of sex , duty and love ."
pos,"caruso sometimes descends into sub-tarantino cuteness . . . but for the most part he makes sure the salton sea works the way a good noir should , keeping it tight and nasty ."
pos,"it's a sweet , laugh-a-minute crowd pleaser that lifts your spirits as well as the corners of your mouth ."
neg,"we get light showers of emotion a couple of times , but then -- strangely -- these wane to an inconsistent and ultimately unsatisfying drizzle ."
neg,"more busy than exciting , more frantic than involving , more chaotic than entertaining ."
neg,the sort of movie that gives tastelessness a bad rap .
neg,a less-than-thrilling thriller .
pos,a psychic journey deep into the very fabric of iranian . . . life .
neg,succeeds in providing a disquiet world the long-dreaded completion of the police academy series .
pos,an edgy thriller that delivers a surprising punch .
pos,"offers big , fat , dumb laughs that may make you hate yourself for giving in . ah , what the hell ."
neg,"offers no new insight on the matter , nor do its characters exactly spring to life ."
pos,"the pain , loneliness and insecurity of the screenwriting process are vividly and painfully brought to slovenly life in this self-deprecating , biting and witty feature written by charlie kaufman and his twin brother , donald , and directed by spike jonze ."
pos,canadian filmmaker gary burns' inventive and mordantly humorous take on the soullessness of work in the city .
pos,a true-blue delight .
neg,"on the bright side , it contains jesse ventura's best work since the xfl ."
neg,"it's so laddish and juvenile , only teenage boys could possibly find it funny ."
pos,you should pay nine bucks for this : because you can hear about suffering afghan refugees on the news and still be unaffected . dramas like this make it human .
neg,"it's difficult to conceive of anyone who has reached puberty actually finding the characters in slackers or their antics amusing , let alone funny ."
neg,the milieu is wholly unconvincing . . . and the histrionics reach a truly annoying pitch .
neg,"the movie is a desperate miscalculation . it gives poor dana carvey nothing to do that is really funny , and then expects us to laugh because he acts so goofy all the time ."
pos,"you could say that it's slow at times , you could say that a few of the characters act in ways that real people wouldn't , but one thing you couldn't say is that alias betty is predictable ."
neg,"the movie has a script ( by paul pender ) made of wood , and it's relentlessly folksy , a procession of stagy set pieces stacked with binary oppositions ."
neg,a by-the-numbers effort that won't do much to enhance the franchise .
pos,it's that rare family movie -- genuine and sweet without relying on animation or dumb humor .
neg,"eddie murphy and owen wilson have a cute partnership in i spy , but the movie around them is so often nearly nothing that their charm doesn't do a load of good ."
neg,"well-meaning to a fault , antwone fisher manages the dubious feat of turning one man's triumph of will into everyman's romance comedy ."
neg,"mckay shows crushingly little curiosity about , or is ill-equipped to examine , the interior lives of the characters in his film , much less incorporate them into his narrative ."
neg,a wretched movie that reduces the second world war to one man's quest to find an old flame .
pos,the movie does a good job of laying out some of the major issues that we encounter as we journey through life .
neg,"the movie is silly beyond comprehension , and even if it weren't silly , it would still be beyond comprehension ."
pos,"about a manga-like heroine who fights back at her abusers , it's energetic and satisfying if not deep and psychological ."
pos,gosling provides an amazing performance that dwarfs everything else in the film .
pos,"moore provides an invaluable service by sparking debate and encouraging thought . better still , he does all of this , and more , while remaining one of the most savagely hilarious social critics this side of jonathan swift ."
neg,"[lee] treats his audience the same way that jim brown treats his women -- as dumb , credulous , unassuming , subordinate subjects . and lee seems just as expectant of an adoring , wide-smiling reception ."
pos,the most ingenious film comedy since being john malkovich .
pos,"lan yu seems altogether too slight to be called any kind of masterpiece . it is , however , a completely honest , open-hearted film that should appeal to anyone willing to succumb to it ."
pos,"a real story about real people living their lives concerned about the future of an elderly , mentally handicapped family member ."
neg,the film can depress you about life itself .
pos,meant to reduce blake's philosophy into a tragic coming-of-age saga punctuated by bursts of animator todd mcfarlane's superhero dystopia .
pos,the film is insightful about kissinger's background and history .
pos,"a splendid entertainment , young in spirit but accomplished in all aspects with the fullness of spirit and sense of ease that comes only with experience ."
neg,"it's like a drive-by . you can drive right by it without noticing anything special , save for a few comic turns , intended and otherwise ."
neg,"if you collected all the moments of coherent dialogue , they still wouldn't add up to the time required to boil a four- minute egg ."
pos,a poignant comedy that offers food for thought .
pos,"it's a clear-eyed portrait of an intensely lived time , filled with nervous energy , moral ambiguity and great uncertainties ."
neg,"it's another stale , kill-by-numbers flick , complete with blade-thin characters and terrible , pun-laden dialogue ."
pos,underachieves only in not taking the shakespeare parallels quite far enough .
pos,"the rich performances by friel -- and especially williams , an american actress who becomes fully english -- round out the square edges ."
neg,how i killed my father is one of those art house films that makes you feel like you're watching an iceberg melt -- only it never melts .
neg,labute was more fun when his characters were torturing each other psychologically and talking about their genitals in public .
pos,"if a horror movie's primary goal is to frighten and disturb , then they works spectacularly well . . . a shiver-inducing , nerve-rattling ride ."
pos,"sheds light on a subject few are familiar with , and makes you care about music you may not have heard before ."
pos,"pacino and williams seem to keep upping the ante on each other , just as their characters do in the film . what results is the best performance from either in years ."
pos,gloriously goofy ( and gory ) midnight movie stuff .
pos,"despite its faults , gangs excels in spectacle and pacing ."
pos,the success of undercover brother is found in its ability to spoof both black and white stereotypes equally .
pos,"gay or straight , kissing jessica stein is one of the greatest date movies in years ."
neg," . . . if you , like me , think an action film disguised as a war tribute is disgusting to begin with , then you're in for a painful ride ."
pos,"maid in manhattan might not look so appealing on third or fourth viewing down the road . . . but as a high concept vehicle for two bright stars of the moment who can rise to fans' lofty expectations , the movie passes inspection ."
pos,"thanks to confident filmmaking and a pair of fascinating performances , the way to that destination is a really special walk in the woods ."
pos,dolgin and franco fashion a fascinating portrait of a vietnamese-born youngster who eagerly and easily assimilated as an all-american girl with a brand new name in southern tennessee .
pos,people cinema at its finest .
pos,"a quiet , pure , elliptical fil"
pos,a solid examination of the male midlife crisis .
pos,very well-written and very well-acted .
pos,"it has the courage to wonder about big questions with sincerity and devotion . it risks seeming slow and pretentious , because it thinks the gamble is worth the promise ."
pos,what's infuriating about full frontal is that it's too close to real life to make sense . what's invigorating about it is that it doesn't give a damn .
neg,just another combination of bad animation and mindless violence . . . lacking the slightest bit of wit or charm .
neg,it has the requisite faux-urban vibe and hotter-two-years-ago rap and r&b names and references .
pos,"if you can get past the fantastical aspects and harsh realities of "" the isle "" you'll get a sock-you-in-the-eye flick that is a visual tour-de-force and a story that is unlike any you will likely see anywhere else ."
pos,"drama of temptation , salvation and good intentions is a thoughtful examination of faith , love and power ."
neg,an unintentionally surreal kid's picture . . . in which actors in bad bear suits enact a sort of inter-species parody of a vh1 behind the music episode .
pos,"the powerpuff girls arrive on the big screen with their super-powers , their super-simple animation and their super-dooper-adorability intact ."
neg,"a banal , virulently unpleasant excuse for a romantic comedy ."
neg, . . . hudlin is stuck trying to light a fire with soggy leaves .
pos,"obligada para impotentes , daneses , camareras italianas , profesores de idiomas , y todo aquel que desee una lengua para expresar su amor ."
neg,"after the setup , the air leaks out of the movie , flattening its momentum with about an hour to go ."
neg,shocking only in that it reveals the filmmaker's bottomless pit of self-absorption .
neg,manages to be both repulsively sadistic and mundane .
pos,rare is the 'urban comedy' that even attempts the insight and honesty of this disarming indie .
pos,this in-depth study of important developments of the computer industry should make it required viewing in university computer science departments for years to come .
neg,"none of this sounds promising and , indeed , the first half of sorority boys is as appalling as any 'comedy' to ever spill from a projector's lens ."
pos,"if you like quirky , odd movies and/or the ironic , here's a fun one ."
pos,"while cherish doesn't completely survive its tonal transformation from dark comedy to suspense thriller , it's got just enough charm and appealing character quirks to forgive that still serious problem ."
neg," . . . has its moments , but ultimately , its curmudgeon doesn't quite make the cut of being placed on any list of favorites ."
pos,"it has the ability to offend and put off everyone , but it holds you with its outrageousness ."
neg,"after you laugh once ( maybe twice ) , you will have completely forgotten the movie by the time you get back to your car in the parking lot ."
neg,a close-to-solid espionage thriller with the misfortune of being released a few decades too late .
neg,"watching austin powers in goldmember is like binging on cotton candy . it's sweet and fluffy at the time , but it may leave you feeling a little sticky and unsatisfied ."
neg,"while easier to sit through than most of jaglom's self-conscious and gratingly irritating films , it's still tainted by cliches , painful improbability and murky points ."
neg,you see robert de niro singing - and dancing to - west side story show tunes . choose your reaction : a . ) that sure is funny ! b . ) that sure is pathetic !
neg,the exclamation point seems to be the only bit of glee you'll find in this dreary mess .
pos,"spielberg's first real masterpiece , it deserved all the hearts it won -- and wins still , 20 years later ."
neg,topkapi this is not .
neg,there's plenty of style in guillermo del toro's sequel to the 1998 hit but why do we need 117 minutes to tell a tale that simply can't sustain more than 90 minutes .
neg,"for all its technical virtuosity , the film is so mired in juvenile and near-xenophobic pedagogy that it's enough to make one pine for the day when godard can no longer handle the rigors of filmmaking ."
pos,"ultimate x is a ride , basically the kind of greatest-hits reel that might come with a subscription to espn the magazine ."
neg,the script was reportedly rewritten a dozen times -- either 11 times too many or else too few .
pos,a rude black comedy about the catalytic effect a holy fool has upon those around him in the cutthroat world of children's television .
pos,"the film's 45-minute running time stops shy of overkill , though viewers may be more exhausted than the athletes onscreen ."
neg," . . . has about 3/4th the fun of its spry 2001 predecessor  but it's a rushed , slapdash , sequel-for-the-sake- of-a-sequel with less than half the plot and ingenuity ."
pos,there's a lot of tooth in roger dodger . but what's nice is that there's a casual intelligence that permeates the script .
pos,"pipe dream does have its charms . the leads are natural and lovely , the pace is serene , the humor wry and sprightly ."
pos,devos delivers a perfect performance that captures the innocence and budding demons within a wallflower .
pos,"a fine , rousing , g-rated family film , aimed mainly at little kids but with plenty of entertainment value to keep grown-ups from squirming in their seats ."
pos,"a pleasant ramble through the sort of idoosyncratic terrain that errol morris has often dealt with . . . it does possess a loose , lackadaisical charm ."
pos,the film tunes into a grief that could lead a man across centuries .
pos,"macdowell . . . gives give a solid , anguished performance that eclipses nearly everything else she's ever done ."
neg,"a silly , self-indulgent film about a silly , self-indulgent filmmaker ."
neg,"think the lion king redone for horses , with fewer deliberate laughs , more inadvertent ones and stunningly trite songs by bryan adams , the world's most generic rock star ."
neg,"far-fetched premise , convoluted plot , and thematic mumbo jumbo about destiny and redemptive love ."
pos,"the passions aroused by the discord between old and new cultures are set against the strange , stark beauty of the mideast desert , so lovingly and perceptively filmed that you can almost taste the desiccated air ."
pos,"funny , sexy , devastating and incurably romantic ."
pos,"a bold and subversive film that cuts across the grain of what is popular and powerful in this high-tech age , speaking its truths with spellbinding imagery and the entrancing music of philip glass ."
pos,it's a fun adventure movie for kids ( of all ages ) that like adventure .
pos,"there is no substitute for on-screen chemistry , and when friel pulls the strings that make williams sink into melancholia , the reaction in williams is as visceral as a gut punch ."
neg,an uneven look into a grim future that doesn't come close to the level of intelligence and visual splendour that can be seen in other films based on philip k . dick stories .
pos,absorbing character study by andré turpin .
neg,the troubling thing about clockstoppers is that it doesn't make any sense .
pos,"the most brilliant and brutal uk crime film since jack carter went back to newcastle , the first half of gangster no . 1 drips with style and , at times , blood ."
neg,so few movies explore religion that it's disappointing to see one reduce it to an idea that fits in a sampler .
pos,"insomnia is one of the year's best films and pacino gives one of his most daring , and complicated , performances ."
neg,an inelegant combination of two unrelated shorts that falls far short of the director's previous work in terms of both thematic content and narrative strength .
pos,norton holds the film together .
pos,"it's still a comic book , but maguire makes it a comic book with soul ."
neg,the movie weighs no more than a glass of flat champagne .
pos,"birot creates a drama with such a well-defined sense of place and age -- as in , 15 years old -- that the torments and angst become almost as operatic to us as they are to her characters ."
pos,"long after you leave justine , you'll be wondering what will happen to her and wishing her the best -- whatever that might mean ."
pos,those who aren't put off by the film's austerity will find it more than capable of rewarding them .
neg,it collapses when mr . taylor tries to shift the tone to a thriller's rush .
pos,you don't have to know about music to appreciate the film's easygoing blend of comedy and romance .
pos,"the four feathers has rewards , from the exoticism of its seas of sand to the fierce grandeur of its sweeping battle scenes ."
pos,"though of particular interest to students and enthusiast of international dance and world music , the film is designed to make viewers of all ages , cultural backgrounds and rhythmic ability want to get up and dance ."
pos,"despite the film's shortcomings , the stories are quietly moving ."
pos,"what i saw , i enjoyed ."
pos,transforms one of [shakespeare's] deepest tragedies into a smart new comedy .
neg,new ways of describing badness need to be invented to describe exactly how bad it is .
pos,this harrowing journey into combat hell vividly captures the chaotic insanity and personal tragedies that are all too abundant when human hatred spews forth unchecked .
pos,a genuinely moving and wisely unsentimental drama .
