sentiment,text
pos,"subversive , meditative , clinical and poetic , the piano teacher is a daring work of genius ."
neg,"since the movie is based on a nicholas sparks best seller , you know death is lurking around the corner , just waiting to spoil things ."
neg,"perceptive in its vision of nascent industrialized world politics as a new art form , but far too clunky , didactic and saddled with scenes that seem simply an ill fit for this movie ."
pos,enriched by a strong and unforced supporting cast .
neg,"the actresses may have worked up a back story for the women they portray so convincingly , but viewers don't get enough of that background for the characters to be involving as individuals rather than types ."
neg,"predictable and cloying , though brown sugar is so earnest in its yearning for the days before rap went nihilistic that it summons more spirit and bite than your average formulaic romantic quadrangle ."
pos,"the path ice age follows most closely , though , is the one established by warner bros . giant chuck jones , who died a matter of weeks before the movie's release ."
neg,"trouble every day is a success in some sense , but it's hard to like a film so cold and dead ."
neg,"an odd , haphazard , and inconsequential romantic comedy ."
pos,"does a good job of establishing a time and place , and of telling a fascinating character's story ."
neg,"a tired , predictable , bordering on offensive , waste of time , money and celluloid ."
pos,one of the best looking and stylish animated movies in quite a while . . .
neg,"from the choppy editing to the annoying score to 'special effects' by way of replacing objects in a character's hands below the camera line , "" besotted "" is misbegotte"
neg,"equilibrium the movie , as opposed to the manifesto , is really , really stupid ."
pos," . . . [the film] works , due mostly to the tongue-in-cheek attitude of the screenplay ."
neg,most of the action setups are incoherent .
neg,"mostly , shafer and co-writer gregory hinton lack a strong-minded viewpoint , or a sense of humor ."
pos,"starts slowly , but adrien brody  in the title role  helps make the film's conclusion powerful and satisfying ."
pos,"wonder , hope and magic can never escape the heart of the boy when the right movie comes along , especially if it begins with the name of star war"
pos,"a thoroughly engaging , surprisingly touching british comedy ."
neg,borrows from so many literary and cinematic sources that this future world feels absolutely deja vu .
pos,very predictable but still entertainin
pos,buy popcorn . take nothing seriously and enjoy the ride .
pos,the actors are fantastic . they are what makes it worth the trip to the theatre .
neg,"nothing sticks , really , except a lingering creepiness one feels from being dragged through a sad , sordid universe of guns , drugs , avarice and damaged dreams ."
neg,makes a joke out of car chases for an hour and then gives us half an hour of car chases .
pos,reno himself can take credit for most of the movie's success . he's one of the few 'cool' actors who never seems aware of his own coolness .
pos,a compelling portrait of moral emptines
pos,a bodice-ripper for intellectuals .
neg,the film's maudlin focus on the young woman's infirmity and her naive dreams play like the worst kind of hollywood heart-string plucking .
neg,"it would be great to see this turd squashed under a truck , preferably a semi ."
neg,is there enough material to merit a documentary on the making of wilco's last album ?
pos,poignant and delicately complex .
pos,it's a ripper of a yarn and i for one enjoyed the thrill of the chill . naomi watts is terrific as rachel ; her petite frame and vulnerable persona emphasising her plight and isolation .
pos,smart and taut .
neg,burns' fifth beer-soaked film feels in almost every possible way -- from the writing and direction to the soggy performances -- tossed off .
pos,an unabashedly schmaltzy and thoroughly enjoyable true story .
neg,"most of the supporting characters in eastwood films are weak , as are most of the subplots . this one's weaker than most ."
neg,the movie gets muted and routine .
neg,"it seems just a long , convoluted ploy to get men into drag -- period drag , no less ."
pos,an intelligent fiction about learning through cultural clash .
neg,"instead of kicking off the intrigue and suspense and mystery of the whole thing , hart's war , like the st . louis rams in the super bowl , waits until after halftime to get started ."
pos,working from a surprisingly sensitive script co-written by gianni romoli . . . ozpetek avoids most of the pitfalls you'd expect in such a potentially sudsy set-up .
neg,dignified ceo's meet at a rustic retreat and pee against a tree . can you bear the laughter ?
neg,[a] painfully flat gross-out comedy . . .
pos,unflinchingly bleak and desperat
pos,cremaster 3 is at once a tough pill to swallow and a minor miracle of self-expression .
pos,"seldahl's barbara is a precise and moving portrait of someone whose world is turned upside down , first by passion and then by illness ."
pos,[a]n utterly charming and hilarious film that reminded me of the best of the disney comedies from the 60s .
pos,an alternately fascinating and frustrating documentary .
neg," . . . will always be remembered for the 9-11 terrorist attacks . after seeing the film , i can tell you that there's no other reason why anyone should bother remembering it ."
pos,"by surrounding us with hyper-artificiality , haynes makes us see familiar issues , like racism and homophobia , in a fresh way ."
neg,"in its own way , joshua is as blasphemous and nonsensical as a luis buñuel film without the latter's attendant intelligence , poetry , passion , and genius ."
pos,"light , cute and forgettable ."
neg,"anyway , for one reason or another , crush turns into a dire drama partway through . after that , it just gets stupid and maudlin . too bad , but thanks to some lovely comedic moments and several fine performances , it's not a total loss ."
pos,a loving little film of considerable appeal .
pos,"it has a dashing and resourceful hero ; a lisping , reptilian villain ; big fights ; big hair ; lavish period scenery ; and a story just complicated enough to let you bask in your own cleverness as you figure it out ."
neg,"whenever you think you've seen the end of the movie , we cut to a new scene , which also appears to be the end . but , no , we get another scene , and then another . you begin to long for the end credits as the desert does for rain ."
neg,"as social exposé , skins has its heart in the right place , but that's not much to hang a soap opera on ."
neg,one of those so-so films that could have been much better .
neg,"even if the enticing prospect of a lot of nubile young actors in a film about campus depravity didn't fade amid the deliberate , tiresome ugliness , it would be rendered tedious by avary's failure to construct a story with even a trace of dramatic interest ."
neg,absurdities and clichés accumulate like lint in a fat man's navel .
neg, . . . the film suffers from a lack of humor ( something needed to balance out the violence ) . . .
neg,the 50-something lovebirds are too immature and unappealing to care about .
neg,those unfamiliar with mormon traditions may find the singles ward occasionally bewildering .
pos,"leigh's daring here is that without once denying the hardscrabble lives of people on the economic fringes of margaret thatcher's ruinous legacy , he insists on the importance of those moments when people can connect and express their love for each other ."
neg,"solondz is without doubt an artist of uncompromising vision , but that vision is beginning to feel , if not morally bankrupt , at least terribly monotonous ."
pos,"awesome work : ineffable , elusive , yet inexplicably powerfu"
pos,"the lion king was a roaring success when it was released eight years ago , but on imax it seems better , not just bigger ."
pos,"while not quite a comedy , the film tackles its relatively serious subject with an open mind and considerable good cheer , and is never less than engaging ."
pos,australia : land beyond time is an enjoyable big movie primarily because australia is a weirdly beautiful place .
pos,"the result puts a human face on derrida , and makes one of the great minds of our times interesting and accessible to people who normally couldn't care less ."
pos,"a genuinely funny ensemble comedy that also asks its audience -- in a heartwarming , nonjudgmental kind of way -- to consider what we value in our daily lives ."
neg,"stale first act , scrooge story , blatant product placement , some very good comedic songs , strong finish , dumb fart jokes ."
pos,it'll keep you wide awake and . . . very tense .
neg,"it is messy , uncouth , incomprehensible , vicious and absurd ."
neg,"instead of panoramic sweep , kapur gives us episodic choppiness , undermining the story's emotional thrust ."
neg,"never again , while nothing special , is pleasant , diverting and modest -- definitely a step in the right direction ."
pos,"cool gadgets and creatures keep this fresh . not as good as the original , but what is . . ."
pos,the inherent strength of the material as well as the integrity of the filmmakers gives this coming-of-age story restraint as well as warmth .
neg,how this one escaped the lifetime network i'll never know .
pos,"morvern callar confirms lynne ramsay as an important , original talent in international cinema ."
neg,"children of the century , though well dressed and well made , ultimately falls prey to the contradiction that afflicts so many movies about writers ."
neg,cedar somewhat defuses this provocative theme by submerging it in a hoary love triangle .
pos,"a mature , deeply felt fantasy of a director's travel through 300 years of russian history ."
neg,"there's a reason the studio didn't offer an advance screening . "" the adventures of pluto nash "" is a big time stinker ."
pos,bielinsky is a filmmaker of impressive talent .
neg,these guys seem great to knock back a beer with but they're simply not funny performers .
neg,empire can't make up its mind whether it wants to be a gangster flick or an art film . it doesn't work as either .
neg,a movie that can't get sufficient distance from leroy's delusions to escape their maudlin influence .
pos,"evokes the frustration , the awkwardness and the euphoria of growing up , without relying on the usual tropes ."
neg,does little more than play an innocuous game of fill-in- the-blanks with a tragic past .
pos,"it's a smartly directed , grown-up film of ideas ."
pos,"here's a british flick gleefully unconcerned with plausibility , yet just as determined to entertain you ."
neg," it wasn't the subject matter that ultimately defeated the film it was the unfulfilling , incongruous , "" wait a second , did i miss something ? "" ending ."
neg,a subtle variation on i spit on your grave in which our purported heroine pathologically avenges a hatred for men .
pos,the film has the uncanny ability to right itself precisely when you think it's in danger of going wrong .
neg,"die another day is only intermittently entertaining but it's hard not to be a sucker for its charms , or perhaps it's just impossible not to feel nostalgia for movies you grew up with ."
pos,that old adage about women being unknowable gets an exhilarating new interpretation in morvern callar .
neg,the chateau . . . is less concerned with cultural and political issues than doting on its eccentric characters .
pos,a poignant lyricism runs through balzac and the little chinese seamstress that transforms this story about love and culture into a cinematic poem .
neg,"though the book runs only about 300 pages , it is so densely packed . . . that even an ambitious adaptation and elaborate production like mr . schepisi's seems skimpy and unclear ."
neg,"the screenplay , co-written by director imogen kimmel , lacks the wit necessary to fully exploit the comic elements of the premise , making the proceedings more bizarre than actually amusing ."
neg,the movie is like scorsese's mean streets redone by someone who ignored it in favor of old 'juvenile delinquent' paperbacks with titles like leather warriors and switchblade sexpot .
neg,"crossroads feels like a teenybopper ed wood film , replete with the pubescent scandalous innuendo and the high-strung but flaccid drama ."
neg,believability wasn't one of the film's virtues .
neg,"deep down , i realized the harsh reality of my situation : i would leave the theater with a lower i . q . than when i had entered ."
neg,any attempts at nuance given by the capable cast is drowned out by director jon purdy's sledgehammer sap .
pos,superb production values & christian bale's charisma make up for a derivative plot .
pos,not since japanese filmmaker akira kurosawa's ran have the savagery of combat and the specter of death been visualized with such operatic grandeur .
neg,dilbert without the right-on satiric humor .
neg,"certain to be distasteful to children and adults alike , eight crazy nights is a total misfire ."
pos,"ub equally spoofs and celebrates the more outre aspects of 'black culture' and the dorkier aspects of 'white culture , ' even as it points out how inseparable the two are ."
pos,"there is a real subject here , and it is handled with intelligence and care ."
pos,"this odd , distant portuguese import more or less borrows from bad lieutenant and les vampires , and comes up with a kind of art-house gay porn film ."
neg,"guys say mean things and shoot a lot of bullets . some of the characters die and others don't , and the film pretends that those living have learned some sort of lesson , and , really , nobody in the viewing audience cares ."
pos,"there's enough science to make it count as educational , and enough beauty to make it unforgettable ."
neg," coarse , cliched and clunky , this trifling romantic comedy in which opposites attract for no better reason than that the screenplay demands it squanders the charms of stars hugh grant and sandra bullock ."
pos,"it is ok for a movie to be something of a sitcom apparatus , if the lines work , the humor has point and the actors are humanly engaged ."
neg,an undistinguished attempt to make a classic theater piece cinematic .
neg,"limps along on a squirm-inducing fish-out-of-water formula that goes nowhere and goes there very , very slowly ."
neg,there are enough throwaway references to faith and rainbows to plant smile-button faces on that segment of the populace that made a walk to remember a niche hit .
pos,a pro-fat farce that overcomes much of its excessive moral baggage thanks to two appealing lead performances .
neg,you have no affinity for most of the characters . nothing about them is attractive . what they see in each other also is difficult to fathom .
neg,"wraps itself in the guise of a dark and quirky comedy , but it isn't as quirky as it thinks it is and its comedy is generally mean-spirited ."
neg,the marquis de sade couldn't have been as dull a person as this film makes him out to be .
neg,insufferably naive .
neg,"what begins as a seemingly brainless , bubbly romantic comedy becomes a cliche-drenched melodrama by mid-film and , by film's end , a feminist action fantasy ."
pos,"the mood , look and tone of the film fit the incredible storyline to a t ."
neg,"it's a long way from orwell's dark , intelligent warning cry [1984] to the empty stud knockabout of equilibrium , and what once was conviction is now affectation ."
pos,the kind of sweet-and-sour insider movie that film buffs will eat up like so much gelati .
neg,"it's a boring movie about a boring man , made watchable by a bravura performance from a consummate actor incapable of being boring ."
pos,"insightfully written , delicately performe"
pos,"a sad , superior human comedy played out on the back roads of life ."
pos,"an absorbing trip into the minds and motivations of people under stress as well as a keen , unsentimental look at variations on the theme of motherhood ."
pos,"it's a talking head documentary , but a great one ."
neg,"sunshine state lacks the kind of dynamic that limbo offers , and in some ways is a rather indulgent piece ."
pos,"it uses an old-time formula , it's not terribly original and it's rather messy -- but you just have to love the big , dumb , happy movie my big fat greek wedding ."
neg,"a piece of mildly entertaining , inoffensive fluff that drifts aimlessly for 90 minutes before lodging in the cracks of that ever-growing category : unembarrassing but unmemorable ."
pos,"feardotcom's thrills are all cheap , but they mostly work ."
neg,this 100-minute movie only has about 25 minutes of decent material .
pos,"lends itself to the narcotizing bland ( sinister , though not nearly so sinister as the biennial disney girl movie ) machinations of the biennial disney boy movie ."
pos,denis and co-writer michele petin's impeccable screenplay penetrates with a rawness that that is both unflinching and tantalizing . lead provocatuers testud and parmentier give superlative performance
neg,"as with so many merchandised-to-the-max movies of this type , more time appears to have gone into recruiting the right bands for the playlist and the costuming of the stars than into the script , which has a handful of smart jokes and not much else ."
neg,"with zoe clarke-williams's lackluster thriller "" new best friend "" , who needs enemies ? just another generic drama that has nothing going for it other than its exploitive array of obligatory cheap thrills ."
pos,star/producer salma hayek and director julie taymor have infused frida with a visual style unique and inherent to the titular character's paintings and in the process created a masterful work of art of their own .
neg,"with little visible talent and no energy , colin hanks is in bad need of major acting lessons and maybe a little coffee ."
neg,"after collateral damage , you might imagine that most every aggrieved father cliché has been unturned . but no ."
neg,the plot grinds on with yawn-provoking dullness .
pos,"this is a very funny , heartwarming film . it has fun with the quirks of family life , but it also treats the subject with fondness and respect ."
pos,[broomfield] uncovers a story powerful enough to leave the screen sizzling with intrigue .
neg,this off-putting french romantic comedy is sure to test severely the indulgence of fans of amélie .
pos,rare birds has more than enough charm to make it memorable .
neg,"not everything in the film works , including its somewhat convenient ending ."
neg,"an overblown clunker full of bad jokes , howling cliches and by-the-numbers action sequences ."
pos,"a pleasant , if forgettable , romp of a film ."
neg,disjointed parody .
pos,"broomfield is energized by volletta wallace's maternal fury , her fearlessness , and because of that , his film crackles ."
neg,it's a fanboy 'what if ? ' brought to life on the big screen .
pos,"a compelling , gut-clutching piece of advocacy cinema that carries you along in a torrent of emotion as it explores the awful complications of one terrifying day ."
pos,"not everyone will welcome or accept the trials of henry kissinger as faithful portraiture , but few can argue that the debate it joins is a necessary and timely one ."
neg,oscar caliber cast doesn't live up to materia
pos,steven spielberg brings us another masterpiec
neg,"[soderbergh] tends to place most of the psychological and philosophical material in italics rather than trust an audience's intelligence , and he creates an overall sense of brusqueness ."
neg,"generic slasher-movie nonsense , but it's not without style ."
neg,tiresomely derivative and hammily acted .
neg,it's just plain lurid when it isn't downright silly .
neg,"though excessively tiresome , the uncertainty principle , as verbally pretentious as the title may be , has its handful of redeeming features , as long as you discount its ability to bore ."
pos,the film is a very good viewing alternative for young women .
neg," a big , baggy , sprawling carnival of a movie , stretching out before us with little rhyme or reason ."
pos,i don't think most of the people who loved the 1989 paradiso will prefer this new version . but i do .
pos,"a moving essay about the specter of death , especially suicide ."
neg,"the characters , cast in impossibly contrived situations , are totally estranged from reality ."
neg,"a tough go , but leigh's depth and rigor , and his skill at inspiring accomplished portrayals that are all the more impressive for their lack of showiness , offsets to a notable degree the film's often-mined and despairing milieu ."
pos," . . . the first 2/3 of the film are incredibly captivating and insanely funny , thanks in part to interesting cinematic devices ( cool visual backmasking ) , a solid cast , and some wickedly sick and twisted humor . . ."
neg,competently directed but terminally cute drama .
neg,too bad writer-director adam rifkin situates it all in a plot as musty as one of the golden eagle's carpets .
neg,a bloated gasbag thesis grotesquely impressed by its own gargantuan aura of self-importance . . .
neg,the lack of naturalness makes everything seem self-consciously poetic and forced . . . it's a pity that [nelson's] achievement doesn't match his ambition .
neg,more maudlin than sharp .
neg,"like schindler's list , the grey zone attempts to be grandiloquent , but ends up merely pretentious -- in a grisly sort of way ."
pos,"[clooney's] debut can be accused of being a bit undisciplined , but it has a tremendous , offbeat sense of style and humor that suggests he was influenced by some of the filmmakers who have directed him , especially the coen brothers and steven soderbergh ."
neg,[plays] in broad outline as pandering middle-age buddy-comedy .
neg,"when not obscured by the booming bass-heavy soundtrack , the conversation presents the kind of linguistic fumbling not heard since macy gray's game of chinese whispers with mr bean ."
pos,a brutally dry satire of middle american numbness .
neg,"[less a movie than] an appalling , odoriferous thing . . . so rotten in almost every single facet of production that you'll want to crawl up your own * * * in embarrassment ."
neg,"denis o'neill's script avoids the prime sports cliche , a last-second goal to win the championship , but it neglects few others ."
neg,"this misty-eyed southern nostalgia piece , in treading the line between sappy and sanguine , winds up mired in tear-drenched quicksand ."
pos,it's absolutely spooky how lillard channels the shagster right down to the original casey kasem-furnished voice .
pos,there are just enough twists in the tale to make it far more satisfying than almost any horror film in recent memory .
pos,"while this gentle and affecting melodrama will have luvvies in raptures , it's far too slight and introspective to appeal to anything wider than a niche audience ."
neg,displays the potential for a better movie than what bailly manages to delive
neg,does anyone much think the central story of brendan behan is that he was a bisexual sweetheart before he took to drink ?
pos,"the movie is well crafted , and well executed . if you're paying attention , the "" big twists "" are pretty easy to guess - but that doesn't make the movie any less entertaining ."
neg,"every potential twist is telegraphed well in advance , every performance respectably muted ; the movie itself seems to have been made under the influence of rohypnol ."
neg,"a sensual performance from abbass buoys the flimsy story , but her inner journey is largely unexplored and we're left wondering about this exotic-looking woman whose emotional depths are only hinted at ."
pos,"like its new england characters , most of whom wander about in thick clouds of denial , the movie eventually gets around to its real emotional business , striking deep chords of sadness ."
neg,strong setup and ambitious goals fade as the film descends into unsophisticated scare tactics and b-film thuggery .
pos,"only an epic documentary could get it all down , and spike lee's jim brown : all american at long last gives its subject a movie worthy of his talents ."
pos,"ultimately too repellent to fully endear itself to american art house audiences , but it is notable for its stylistic austerity and forcefulness ."
pos,"at its worst , the movie is pretty diverting ; the pity is that it rarely achieves its best ."
pos,gives an intriguing twist to the french coming-of-age genre .
pos,a party-hearty teen flick that scalds like acid .
pos,"while the path may be familiar , first-time director denzel washington and a top-notch cast manage to keep things interesting ."
neg,the film's overall mood and focus is interesting but constantly unfulfilling .
neg,a film so tedious that it is impossible to care whether that boast is true or not .
neg,"it may be an easy swipe to take , but this barbershop just doesn't make the cut ."
pos,provides a very moving and revelatory footnote to the holocaust .
neg,"a static and sugary little half-hour , after-school special about interfaith understanding , stretched out to 90 minutes ."
pos,enticing and often funny documentary .
pos,"expect no major discoveries , nor any stylish sizzle , but the film sits with square conviction and touching good sense on the experience of its women ."
pos,"scherfig , the writer-director , has made a film so unabashedly hopeful that it actually makes the heart soar . yes , soar ."
neg,why spend $9 on the same stuff you can get for a buck or so in that greasy little vidgame pit in the theater lobby ?
neg,aan opportunity wasted .
neg,"wanders all over the map thematically and stylistically , and borrows heavily from lynch , jeunet , and von trier while failing to find a spark of its own ."
neg,looks awfully like one long tourist spot for a mississippi that may never have existed outside of a scriptwriter's imagination .
