sentiment,text
pos,"films are made of little moments . changing lanes tries for more . it doesn't reach them , but the effort is gratefully received ."
pos,"while it would be easy to give crush the new title of two weddings and a funeral , it's a far more thoughtful film than any slice of hugh grant whimsy ."
pos,"meeting , even exceeding expectations , it's the best sequel since the empire strikes back . . . a majestic achievement , an epic of astonishing grandeur and surprising emotional depth ."
neg,"while the script starts promisingly , it loses steam towards the middle and never really develops beyond attacking obvious target ."
pos," . . . enthusiastically invokes the percussion rhythm , the brass soul and the sense of fierce competition that helps make great marching bands half the fun of college football games ."
neg, . . . the picture's cleverness is ironically muted by the very people who are intended to make it shine .
neg,the movie has very little to offer besides unintentional laughs .
pos,"while not quite "" shrek "" or monsters , inc . "" , it's not too bad . it's worth taking the kids to ."
neg,"theological matters aside , the movie is so clumsily sentimental and ineptly directed it may leave you speaking in tongues ."
pos,"goyer's screenplay and direction are thankfully understated , and he has drawn excellent performances from his cast ."
neg,"this miserable excuse of a movie runs on empty , believing flatbush machismo will get it through ."
pos,"a fascinating , dark thriller that keeps you hooked on the delicious pulpiness of its lurid fiction ."
neg,it would be hard to think of a recent movie that has worked this hard to achieve this little fun .
neg,a little more intensity and a little less charm would have saved this film a world of hurt .
pos,the plot is so amusingly contrived and outlandish in its coincidences that no one could ever mistake it for anything resembling realit
neg,"the idea is more interesting than the screenplay , which lags badly in the middle and lurches between not-very-funny comedy , unconvincing dramatics and some last-minute action strongly reminiscent of run lola run ."
pos,"as shaky as the plot is , kaufman's script is still memorable for some great one-liners ."
pos,the gentle comic treatment of adolescent sturm und drang should please fans of chris fuhrman's posthumously published cult novel .
neg,"utterly lacking in charm , wit and invention , roberto benigni's pinocchio is an astonishingly bad film ."
pos,it's like going to a house party and watching the host defend himself against a frothing ex-girlfriend . you don't want to call the cops . you want to call domino's .
neg,mctiernan's remake may be lighter on its feet -- the sober-minded original was as graceful as a tap-dancing rhino -- but it is just as boring and as obvious .
pos,"beresford nicely mixes in as much humor as pathos to take us on his sentimental journey of the heart . it really is a shame that more won't get an opportunity to embrace small , sweet 'evelyn . "
pos,"as an introduction to the man's theories and influence , derrida is all but useless ; as a portrait of the artist as an endlessly inquisitive old man , however , it's invaluable ."
pos,haynes has so fanatically fetishized every bizarre old-movie idiosyncrasy with such monastic devotion you're not sure if you should applaud or look into having him committed .
pos,"it's easy to be cynical about documentaries in which underdogs beat the odds and the human spirit triumphs , but westbrook's foundation and dalrymple's film earn their uplift ."
neg,not since freddy got fingered has a major release been so painful to sit through .
pos,an excellent romp that boasts both a heart and a mind .
neg,there's not much going on in this movie unless you simply decide to buy into the notion that something inexplicably strange once happened in point pleasant .
neg,the film's needlessly opaque intro takes its doe-eyed crudup out of pre-9/11 new york and onto a cross-country road trip of the homeric kind .
neg," . . . ice age treads predictably along familiar territory , making it a passable family film that won't win many fans over the age of 12 ."
neg,"supposedly based upon real , or at least soberly reported incidents , the film ends with a large human tragedy . alas , getting there is not even half the interest ."
neg,"a film of empty , fetishistic violence in which murder is casual and fun ."
pos,"real women may have many agendas , but it also will win you over , in a big way ."
neg,'rare birds' tries to force its quirkiness upon the audience .
neg,"boy oh boy , it's a howler ."
pos,anyone who ever fantasized about space travel but can't afford the $20 million ticket to ride a russian rocket should catch this imax offering .
neg,"put it somewhere between sling blade and south of heaven , west of hell in the pantheon of billy bob's body of work ."
pos,"in the disturbingly involving family dysfunctional drama how i killed my father , french director anne fontaine delivers an inspired portrait of male-ridden angst and the emotional blockage that accompanies this human conditio"
neg,"this piece of channel 5 grade trash is , quite frankly , an insult to the intelligence of the true genre enthusiast ."
neg,"there seems to be no clear path as to where the story's going , or how long it's going to take to get there ."
pos,"the strength of the film comes not from any cinematic razzle-dazzle but from its recovery of an historical episode that , in the simple telling , proves simultaneously harrowing and uplifting ."
neg,"flat , misguided comedy ."
neg,"occasionally loud and offensive , but more often , it simply lulls you into a gentle waking coma ."
pos,cho's latest comic set isn't as sharp or as fresh as i'm the one that i want . . . but it's still damn funny stuff .
pos,"khouri manages , with terrific flair , to keep the extremes of screwball farce and blood-curdling family intensity on one continuum ."
pos,"gorgeous scenes , masterful performances , but the sickly sweet gender normative narrative left an acrid test in this gourmet's mouth ."
neg,"shows holmes has the screen presence to become a major-league leading lady , ( but ) the movie itself is an underachiever , a psychological mystery that takes its sweet time building to a climax that's scarcely a surprise by the time it arrives ."
pos,it's fascinating to see how bettany and mcdowell play off each other .
pos,"a different and emotionally reserved type of survival story -- a film less about refracting all of world war ii through the specific conditions of one man , and more about that man lost in its midst ."
pos,"asks what truth can be discerned from non-firsthand experience , and specifically questions cinema's capability for recording truth ."
pos,"in adobo , ethnicity is not just the spice , but at the heart of more universal concerns ."
pos,"this time , the hype is quieter , and while the movie is slightly less successful than the first , it's still a rollicking good time for the most part ."
neg,"whether it's the worst movie of 2002 , i can't say for sure : memories of rollerball have faded , and i skipped country bears . but this new jangle of noise , mayhem and stupidity must be a serious contender for the title ."
pos,"the far future may be awesome to consider , but from period detail to matters of the heart , this film is most transporting when it stays put in the past ."
pos,"antwone fisher certainly does the trick of making us care about its protagonist and celebrate his victories but , with few exceptions , it rarely stoops to cheap manipulation or corny conventions to do it ."
neg,"if you believe any of this , i can make you a real deal on leftover enron stock that will double in value a week from friday ."
neg,"problem is , we have no idea what in creation is going on ."
neg,"the irwins emerge unscathed , but the fictional footage is unconvincing and criminally badly acted ."
neg,just a bunch of good actors flailing around in a caper that's neither original nor terribly funny .
pos,a film of precious increments artfully camouflaged as everyday activities .
pos,there's no denying that burns is a filmmaker with a bright future ahead of him .
neg,"excessive , profane , packed with cartoonish violence and comic-strip characters ."
pos,"it's tough to watch , but it's a fantastic movie ."
pos," . . . once the true impact of the day unfolds , the power of this movie is undeniable ."
pos,"this is as powerful a set of evidence as you'll ever find of why art matters , and how it can resonate far beyond museum walls and through to the most painfully marginal lives ."
pos,refreshing .
neg,return to neverland manages to straddle the line between another classic for the company and just another run-of-the-mill disney sequel intended for the home video market .
neg,"yes , ballistic is silly . unfortunately , it's not silly fun unless you enjoy really bad movies ."
neg,"when cowering and begging at the feet a scruffy giannini , madonna gives her best performance since abel ferrara had her beaten to a pulp in his dangerous game ."
pos,"rarely , a movie is more than a movie . go ."
neg,"despite its title , amy's orgasm is not a porno , though it is as tedious as one ."
neg,"as an actress , madonna is one helluva singer . as the mediterranean sparkles , 'swept away' sinks ."
neg,"while the film misfires at every level , the biggest downside is the paucity of laughter in what's supposed to be a comedy ."
neg,"i'm sure the filmmakers found this a remarkable and novel concept , but anybody who has ever seen an independent film can report that it is instead a cheap cliché ."
neg,"it's supposed to be a humorous , all-too-human look at how hope can breed a certain kind of madness -- and strength -- but it never quite adds up ."
neg," sandra bullock and hugh grant make a great team , but this predictable romantic comedy should get a pink slip ."
neg,the story really has no place to go since simone is not realshe can't provide any conflict .
pos,"complex , affecting and uniquely almodóvar , the film evokes strong emotions and pushes viewers to question their deepest notions of moral right and wrong ."
neg,suffers from unlikable characters and a self-conscious sense of its own quirky hipness .
neg,cherish would've worked a lot better had it been a short film .
neg,"wasabi is slight fare indeed , with the entire project having the feel of something tossed off quickly ( like one of hubert's punches ) , but it should go down smoothly enough with popcorn ."
neg,[hell is] looking down at your watch and realizing serving sara isn't even halfway through .
pos,"a beguiling , slow-moving parable about the collision of past and present on a remote seacoast in iran ."
pos,"there is little question that this is a serious work by an important director who has something new to say about how , in the flip-flop of courtship , we often reel in when we should be playing out ."
neg,its characters are thinner than cardboard -- or even comic-book paper .
neg,"for all of its insights into the dream world of teen life , and its electronic expression through cyber culture , the film gives no quarter to anyone seeking to pull a cohesive story out of its 2 1/2-hour running time ."
pos,"at the end , when the now computerized yoda finally reveals his martial artistry , the film ascends to a kinetic life so teeming that even cranky adults may rediscover the quivering kid inside ."
pos,"director juan jose campanella could have turned this into an argentine retread of "" iris "" or "" american beauty , "" but instead pulls a little from each film and creates something more beautiful than either of those films ."
neg,"pumpkin means to be an outrageous dark satire on fraternity life , but its ambitions far exceed the abilities of writer adam larson broder and his co-director , tony r . abrams , in their feature debut ."
neg,kim ki-deok seems to have in mind an ( emotionally at least ) adolescent audience demanding regular shocks and bouts of barely defensible sexual violence to keep it interested .
neg,[siegel] and co-writers lisa bazadona and grace woodard have relied too much on convention in creating the characters who surround frankie .
pos,"it's rather like a lifetime special -- pleasant , sweet and forgettable ."
pos,"unlike most teen flicks , swimming takes its time to tell its story , casts mostly little-known performers in key roles , and introduces some intriguing ambiguity ."
pos,"the film is reasonably entertaining , though it begins to drag two-thirds through , when the melodramatic aspects start to overtake the comedy ."
neg,"while american adobo has its heart ( and its palate ) in the right place , its brain is a little scattered -- ditsy , even ."
pos,the fly-on-the-wall method used to document rural french school life is a refreshing departure from the now more prevalent technique of the docu-makers being a visible part of their work .
pos,one of the most exciting action films to come out of china in recent years .
neg,a minor picture with a major identity crisis -- it's sort of true and it's sort of bogus and it's ho-hum all the way through .
neg,"as 'chick flicks' go , this one is pretty miserable , resorting to string-pulling rather than legitimate character development and intelligent plotting ."
neg,demme's loose approach kills the suspense .
neg,a movie that hovers somewhere between an acute character study and a trite power struggle .
neg,the only thing in pauline and paulette that you haven't seen before is a scene featuring a football field-sized oriental rug crafted out of millions of vibrant flowers .
pos,"the film is a hoot , and is just as good , if not better than much of what's on saturday morning tv especially the pseudo-educational stuff we all can't stand ."
neg,instead of building to a laugh riot we are left with a handful of disparate funny moments of no real consequence .
neg,"a dull , inconsistent , dishonest female bonding picture ."
pos,able to provide insight into a fascinating part of theater history .
pos,"an 83 minute document of a project which started in a muddle , seesawed back and forth between controlling interests multiple times , then found its sweet spo"
pos, . . . a triumph of emotionally and narratively complex filmmaking .
pos,"[haynes'] homage to such films as "" all that heaven allows "" and "" imitation of life "" transcends them . simply put , "" far from heaven "" is a masterpiece ."
pos,"is not so much a work of entertainment as it is a unique , well-crafted psychological study of grief ."
neg,diaz wears out her welcome in her most charmless performanc
neg,"piccoli's performance is amazing , yes , but the symbols of loss and denial and life-at-arm's-length in the film seem irritatingly transparent ."
pos,"it may be a no-brainer , but at least it's a funny no-brainer ."
neg,"if somebody was bored and . . . decided to make a dull , pretentious version of jesus' son , they'd come up with something like bart freundlich's world traveler ."
neg,bearable . barely .
pos,noyce creates a film of near-hypnotic physical beauty even as he tells a story as horrifying as any in the heart-breakingly extensive annals of white-on-black racism .
neg,"this is the kind of movie that you only need to watch for about thirty seconds before you say to yourself , 'ah , yes , here we have a bad , bad , bad movie . "
neg,"on its own , it's not very interesting . as a remake , it's a pale imitation ."
pos,"a vivid , spicy footnote to history , and a movie that grips and holds you in rapt attention from start to finish ."
pos," . . . planos fijos , tomas largas , un ritmo pausado y una sutil observación de sus personajes , sin estridencias ni grandes revelaciones ."
pos,an involving true story of a chinese actor who takes up drugs and winds up in an institution--acted mostly by the actual people involved .
pos,genuinely unnerving .
pos,"both an admirable reconstruction of terrible events , and a fitting memorial to the dead of that day , and of the thousands thereafter ."
neg,"we have poignancy jostling against farce , thoughtful dialogue elbowed aside by one-liners , and a visual style that incorporates rotoscope animation for no apparent reason except , maybe , that it looks neat ."
pos,full frontal is the antidote for soderbergh fans who think he's gone too commercial since his two oscar nominated films in 200
neg,"plays as hollow catharsis , with lots of tears but very little in the way of insights ."
pos,"constantly touching , surprisingly funny , semi-surrealist exploration of the creative act ."
pos,"the unique tug-of-war with viewer expectations is undeniable , if not a pleasure in its own right ."
pos,"finally , the french-produced "" read my lips "" is a movie that understands characters must come first ."
pos," "" home movie "" is a sweet treasure and something well worth your time ."
pos,"funny and , at times , poignant , the film from director george hickenlooper all takes place in pasadena , "" a city where people still read . """
pos,high crimes steals so freely from other movies and combines enough disparate types of films that it can't help but engage an audience .
pos,huppert's superbly controlled display of murderous vulnerability ensures that malice has a very human face .
neg,too infuriatingly quirky and taken with its own style .
neg,"what's next : "" my mother the car ? """
neg, . . . hokey art house pretension .
neg,all the characters are clinically depressed and have abandoned their slim hopes and dreams .
neg,"with or without ballast tanks , k-19 sinks to a harrison ford low ."
neg,"astonishing isn't the word -- neither is incompetent , incoherent or just plain crap . indeed , none of these words really gets at the very special type of badness that is deuces wild ."
pos,what's so striking about jolie's performance is that she never lets her character become a caricature -- not even with that radioactive hair .
pos,"one of those rare films that seems as though it was written for no one , but somehow manages to convince almost everyone that it was put on the screen , just for them ."
neg,"woo has as much right to make a huge action sequence as any director , but how long will filmmakers copy the "" saving private ryan "" battle scenes before realizing steven spielberg got it right the first time ?"
pos,i am more offended by his lack of faith in his audience than by anything on display here .
pos,by turns very dark and very funny .
neg,"'ejemplo de una cinta en que no importa el talento de su reparto o lo interesante que pudo haber resultado su premisa , pues el resultado es francamente aburrido y , por momentos , deplorable . "
neg,"her fans walked out muttering words like "" horrible "" and "" terrible , "" but had so much fun dissing the film that they didn't mind the ticket cost . in this case zero ."
pos,"harris commands the screen , using his frailty to suggest the ravages of a life of corruption and ruthlessness ."
neg,"rock's stand-up magic wanes . hopkins , squarely fills the screen . action - mechanical ."
pos,"the film's appeal has a lot to do with the casting of juliette binoche as sand , who brings to the role her pale , dark beauty and characteristic warmth ."
pos,well cast and well directed - a powerful drama with enough sardonic wit to keep it from being maudlin .
pos,"may take its sweet time to get wherever it's going , but if you have the patience for it , you won't feel like it's wasted yours ."
pos,one of those terrific documentaries that collect a bunch of people who are enthusiastic about something and then figures out how to make us share their enthusiasm .
pos,"strange it is , but delightfully so ."
neg, . . . standard guns versus martial arts cliche with little new added .
pos," "" the ring "" is pretty much an english-language copy of the film that inspired it , and it carries the same strengths and flaws ."
neg,"writhing under dialogue like 'you're from two different worlds' and 'tonight the maid is a lie and this , this is who you are , ' this schlock-filled fairy tale hits new depths of unoriginality and predictability ."
neg,a solid film . . . but more conscientious than it is truly stirring .
neg,it recycles every cliché about gays in what is essentially an extended soap opera .
pos,"if you are an actor who can relate to the search for inner peace by dramatically depicting the lives of others onstage , then esther's story is a compelling quest for truth ."
neg,"it desperately wants to be a wacky , screwball comedy , but the most screwy thing here is how so many talented people were convinced to waste their time ."
neg,more tiring than anything .
neg,"such a fine idea for a film , and such a stultifying , lifeless execution ."
neg,"skins has a right to yawp , and we have a right to our grains of salt ."
neg,like a soft drink that's been sitting open too long : it's too much syrup and not enough fizz .
pos,"in auteil's less dramatic but equally incisive performance , he's a charismatic charmer likely to seduce and conquer ."
pos,happily stays close to the ground in a spare and simple manner and doesn't pummel us with phony imagery or music .
neg,"though impostor deviously adopts the guise of a modern motion picture , it too is a bomb ."
neg,"[johnnie to and wai ka fai are] sure to find an enthusiastic audience among american action-adventure buffs , but the film's interests may be too narrow to attract crossover viewers ."
neg,largely a for-fans artifact .
neg,"nohe has made a decent 'intro' documentary , but he feels like a spectator and not a participant ."
neg,"the main characters are simply named the husband , the wife and the kidnapper , emphasizing the disappointingly generic nature of the entire effort ."
neg,the chocolate factory without charlie .
neg,utter mush . . . conceited pap .
pos,"it is risky , intelligent , romantic and rapturous from start to finish ."
pos,"shiri is an action film that delivers on the promise of excitement , but it also has a strong dramatic and emotional pull that gradually sneaks up on the audience ."
neg,nothing more or less than an outright bodice-ripper -- it should have ditched the artsy pretensions and revelled in the entertaining shallows .
pos,watching spirited away is like watching an eastern imagination explode .
pos,this bold and lyrical first feature from raja amari expands the pat notion that middle-aged women just wanna have fun into a rousing treatise of sensual empowerment .
pos,"as chilling and fascinating as philippe mora's modern hitler-study , snide and prejudice ."
pos,"an example of quiet , confident craftsmanship that tells a sweet , charming tale of intergalactic friendship ."
pos,imagine a scenario where bergman approaches swedish fatalism using gary larson's far side humo
pos,this movie has the usual impossible stunts . . . but it has just as many scenes that are lean and tough enough to fit in any modern action movie .
pos,"taken outside the context of the current political climate ( see : terrorists are more evil than ever ! ) , the sum of all fears is simply a well-made and satisfying thriller ."
pos,"the film's plot may be shallow , but you've never seen the deep like you see it in these harrowing surf shots ."
pos,"a simple tale of an unlikely friendship , but thanks to the gorgeous locales and exceptional lead performances , it has considerable charm ."
pos,"an intelligent , moving and invigorating film ."
neg,"very special effects , brilliantly bold colors and heightened reality can't hide the giant achilles' heel in "" stuart little 2 "" : there's just no story , folks ."
pos,it's an often-cute film but either needs more substance to fill the time or some judicious editing .
pos,"a vibrant , colorful , semimusical rendition ."
pos,cho's timing is priceless .
neg,strangely comes off as a kingdom more mild than wild .
neg,"none of this has the suavity or classical familiarity of bond , but much of it is good for a laugh . the problem with "" xxx "" is that its own action isn't very effective ."
neg,schindler's list it ain't .
neg,"told in scattered fashion , the movie only intermittently lives up to the stories and faces and music of the men who are its subject ."
neg,"kids don't mind crappy movies as much as adults , provided there's lots of cute animals and clumsy people . 'snow dogs' has both ."
neg,"soderbergh seems capable only of delivering artfully lighted , earnest inquiries that lack the kind of genuine depth that would make them redeemable ."
neg,"the result is good gossip , entertainingly delivered , yet with a distinctly musty odour , its expiry date long gone ."
pos,"all in all , it's a pretty good execution of a story that's a lot richer than the ones hollywood action screenwriters usually come up with on their own ."
pos," "" on guard ! "" won't be placed in the pantheon of the best of the swashbucklers but it is a whole lot of fun and you get to see the one of the world's best actors , daniel auteuil , have a whale of a good time ."
neg,"the merchant-ivory team continues to systematically destroy everything we hold dear about cinema , only now it's begun to split up so that it can do even more damage ."
pos,"another in a long line of ultra-violent war movies , this one is not quite what it could have been as a film , but the story and theme make up for it ."
neg,"though it goes further than both , anyone who has seen the hunger or cat people will find little new here , but a tasty performance from vincent gallo lifts this tale of cannibal lust above the ordinary ."
neg,less worrying about covering all the drama in frida's life and more time spent exploring her process of turning pain into art would have made this a superior movie .
neg," . . . if you're just in the mood for a fun -- but bad -- movie , you might want to catch freaks as a matinee ."
